resume_id;filename;Experience;Education;Skills;Projects;Certificates / Courses
10089434;10089434.pdf;Information Technology Technician I Aug 2007 Current Company Name i14 City , State Migrating manage user account Microsoft Office 365 Exchange Online . Creating manage virtual machine systems domain controllers Active Directory Federation Services ( ADFS ) Microsoft Windows Azure ( IaaS ) . Creating manage storage Microsoft Windows Azure ( IaaS ) . Installing configure StorSimple iSCSI cloud array ( STaaS/BaaS ) . Installing , configure , test Twinstrata iSCSI cloud array ( STaaS/BaaS ) . Collaborating project plan Office 365 migration . Developing detail specifications Office 365 migration , include business-case documentation , cost benefit analyse , technical diagram , work flow documentation . Received train MVC 4 Visual Studio use .Net Framework 4/4.5 develop application use HTML5 CSS3 . Installing , configure , support Linux machine open Wi-Fi network project . Compiling generate statistical information concern wireless network traffic use Cacti . Configuring wireless LAN router network security access . Installing configure wireless;Bachelor Science , Information Technology 2005 Florida International Univeristy i14 City , State , United States Coursework Programming , Web Administration , Network Administration , Database Administration , Systems Administration  Linux;Active Directory , Azure , anti-virus , Backup Exec , backup , Bash , batch , Cacti , Cisco ASA , databases , DHCP , DNS , documentation , DataDomain , EMC , Enterprise Vault , ePO , file servers , firewall , GPO , HTML , IIS , ISA , LDAP , Linux , McAfee , Exchange , Microsoft Office , Microsoft Windows , security , policies , PowerShell , program , proxy server , servers , script , SolarWinds , SQL , StorSimple , troubleshoot , TMG , Ubuntu , Visual Basic Script , VBS , Veritas Netbackup , VPN , VRanger , Veeam , VMWare , VDI , virtual manchine , NMap , ZenMap .;. Collaborating project plan Hyperion MiamiBiz . Preparing presentations documentation demonstrate Hyperion MiamiBiz functionality design . Monitoring network traffic , compile generate statistical information use Solar Winds . Collaborating Disaster Recovery plan procedures . Researching , evaluate , recommend new hardware new software . Communicating define systems design requirements new exist systems applications . Researching , evaluate , recommend , test , implement third party software/utilities . Planning design network infrastructure change  adding/removing servers , appliances , network logical flow . Reviewing , evaluate , analyze exist system application viability management staff . Administering maintain share file servers . Reviewing server log troubleshoot issue . Scheduling apply hot fix security patch server infrastructure include operate system application software . Reviewing systems report SCCM ( System Center Configuration Manager ) . Resolving service request escalate Help Desk technicians . Troubleshooting analyze system problems root cause analysis . Giving participate train;CompTIA Network+ - 2014
10247517;10247517.pdf;04/2013 Current Information Technology Manager Company Name i14 City , State A bankruptcy Trustee office handle Chapter 13 Chapter 12 case Northern District Georgia Manages application database/hardware systems use track Chapter 13 bankruptcy case , office;Master Science : Leadership Walden University i14 City , State 2015 Master Science : Information Systems Management Project Management Walden University i14 City , State 2013 Bachelor Science : Information Systems Management Mechanical Engineering Walden University i14 City , State;anti-virus , backup , cable , Cisco , hardware , contract , client , clients , database , disaster recovery plan , disaster recovery , email , ERP , feature , image , information systems , inspection , Inspects , LAN , notebooks , laptops , Mechanical , access , office , enterprise , Network Administrator , network , network , Nortel , peripherals , pick , policies , printers , program , real-time , scanner , schedule , servers , script , ship , switch , switch , user documentation , telecom , WAN , wire;". Designed implement network infrastructure enhancements improve performance , security , remote access , connectivity . Standardized hardware , peripherals , software . Established helpdesk support system monitor , prioritize , schedule request . Spearheaded deployment new track system provide performance metrics use identify additional train resources require . Researched , instal , configure enterprise backup solution disaster recovery include feature allow users recover delete items without need recover DR backups . Doubled WAN bandwidth propel LAN WLAN performance 100 % higher WAN , LAN , WLAN reconfiguration . Improved accuracy , double efficiency 35 % 87 % , increase cost savings $ 250/quarter $ 2,500/quarter develop automate script retrieve data outside server . Automated asset track employ hand scanner database system improve efficiency accuracy . 08/1987 06/2012 Network Analyst Company Name i14 City , State A $ 1B+ global manufacturer equipment precision material dispense , test , inspection , surface preparation , cure Fueled 1,000 % improvement LAN performance replace exist network , entail change software LAN cable 20 exist switch , include reconfiguring core switch remote wire closet multiple stack units . Led team five network equipment support specialists.Configured , maintain , analyze , troubleshot Nortel Juniper network , systems , equipment ( WAN/LAN/WLAN infrastructure , servers , PCs , notebooks , thin clients , printers , peripherals ) use 600 workers Georgia.Supported 200 units configure operation client servers.Advanced global company objectives participation IT telecom design implementation.Advanced role promotions Mechanical Drafter , Engineering Checker , Mechanical Designer , Network Administrator.Slashed support request 75 % , cut equipment cost 50 % , boost work productivity 30 % apply near-zero configuration develop , install , implement thin client solution 90 plant manufacture cells . Reduced standard company image system deployment time 60 % station-specific customization replace and/or refresh 40 PCs quarter , 100 % schedule . Planned , design , instal , configure , test wireless network ( WLAN Cisco , Nortel , Meraki ) multiple facilities ; document standards US operations ; train users ; monitor performance . Replaced 125 field service laptops program standard image custom configurations machine , complete six- week project schedule despite disruption part availability due tsunami . Championed use computers manufacture cells provide drawings also facilitate order track conjunction ERP system ; design implement automate pick list ship document well real-time track distribution . Trained mentor 15 new department staff members contractors . 02/1753 Designer/Drafter Company Name i14 City , State Plant Manager/Quality Control Manager Company Name i14 City , State Drafter Company Name i14 City , State Accomplishments Microsoft Word/Excel/Access/Outlook/PowerPoint/Visio/Publisher/Project , Apple Pages , Numbers , Keynote , Autodesk , AutoCAD , Microsoft Word/Excel/Access/Outlook/PowerPoint/Visio/Publisher/Project , Apple Pages , Numbers , Keynote , Autodesk , AutoCAD , SolidWorks , SAP r3 Operating Systems : Microsoft SQL , Microsoft Exchange , SCCM , DOS 6.22 , Windows 3.1-Windows 10 , Windows NT 3.5 Server , Windows Server 2012 , OSX 10.2-10.11 , IOS Hardware WLAN : Nortel , Mitel , Shortel , Cisco , Meraki , Apple AirPort , Palo Alto-Firewall , Sonicwall Firewall Peripherals : Barracuda Web Filter , Barracuda Message Archiver , Riverbed-WAN Accelerator , Dell ISCSI SAN Installation Configuration : Dell PowerVault , Adtran Routers , Cisco Routers , Catalyst Switches , HP Procurve Switches , ICC Patch Panels , Cross Connects , Cat3-6A ( Phone Data )";MCP , A CompTIA Network+ , CompTIA A+
12045067;12045067.pdf;Information Technology ( IT ) Specialist January 2012 Company Name IT Specialist Project Engineer December 2009 Current City , State U.S. Army Information Systems Engineering Command ( USAISEC );Bachelor Science ( BS ) : Information Technology , 2005 University Phoenix GPA : GPA : 3.67 Information Technology GPA : 3.67 Associates Applied Science ( AAS ) : Electronic Technology , 2003 Cochise College GPA : GPA : 4.0 Phi Theta Kappa Electronic Technology GPA : 4.0 Phi Theta Kappa Associate : General Studies , 2001 AGS Cochise College GPA : GPA : 4.0 Phi Theta Kappa General Studies GPA : 4.0 Phi Theta Kappa;Administrative , Analyst , Army , Agency , cable , cable , Cat5 , documentation , Engineer , engineer support , financial , Functional , Government , IMS , Information Systems , Information Technology , local area network , Local Area Network , LANs , LAN , law , Materials , meetings , Office , Network , network , personnel , procurement , project leader , project coordination , QA , quick , Radio , rout , SAT , schedule , Supervisor , survey , Switch , System Design , Systems Integration , telecommunications , Telephone , Theatre , UHF , Ultra High Frequency , upgrade , upgrade , validation , Vista , voice data;involve C2 facility upgrade well Command Headquarters relocations . Provided IT engineer support US Southern Command ( SOUTHCOM ) headquarter relocation project , include develop FDC part design-build contract process USACE . Developed SDP , LOM , cost estimate test plan radio satellite systems , copper fiber cable plant , lightning protection systems , ground , bond shield systems relate infrastructure Defense Threat Reduction Agency ( DTRA ) relocation project . Provided on-site engineer support voice , data , visual information systems instal United States Army South ( USARSO ) Headquarters Installation Management Agency ( IMA ) Fort Sam Houston , Texas . Provided detail engineer design installation Briefing Display Facilities ( BDF ) , Conference Rooms , Command Center Areas , Telecommunications Rooms ( TRs ) , Open Office Areas . Conducted QA / QC check test Defense Red Switch Network ( DRSN ) , Global Command Control System ( GCCS ) , Unclassified Local Area Network ( NIPRNET ) , Secret Local Area Network ( SIPRNET ) , Sensitive Compartmented Local Area Network ( SCI LAN ) , Administrative Telephone System , Visual Information Systems . Assisted USAISEC Force Projection Engineering Directorate , 1st Signal Brigade personnel design installation C2 facility upgrade 19th Theatre Support Command South Korea . Performed site survey , gather user requirements several staff directorates operational elements within command develop SDP , EIP LOMs upgrade Global Command Control System ( GCCS ) communications systems well administrative tactical voice systems . Provided engineer support development C2 facility U.S. Army Central Command ( USCENTCOM ) Headquarters foreign coalition force Doha , Qatar support Operation Iraqi Freedom . These efforts include various secure voice , data , visual information systems critical Command Center operations . Supervised assist rout , termination acceptance test fiber optic Cat5 cable , voice data systems relate telecommunications equipment infrastructure .;
12334140;12334140.pdf;Production Associate 03/2006 Current Company Name City , State cover letter typically accompany resume send . Your cover letter may make difference obtain job interview resume ignore , make good sense devote necessary time effort write effective cover letter . A cover letter complement , duplicate , resume . Its purpose interpret data-oriented , factual resume add personal touch . A cover letter often earliest write contact potential employer , create critical first impression . Find differences resume cover letter . There three general type cover letter : The application letter respond know job open ( review sample ) The prospect letter inquire possible position ( review sample ) The network letter request information assistance job search ( review sample ) Your cover letter design specifically purpose outline well position seek . Do design form letter send every potential employer ( know junk mail ! ) . Effective cover letter explain reason interest specific organization identify relevant;KnowledgeSoft , Inc. , Mechanicsburg , PA , 3/1997;Accounting , administrative , agency , Basic Programming , Bookkeeping , Business Communication , hardware , Finance , fundraise , help desk support , help desk , IBM , IBM Software , inventory , letter , Lotus 2.1 , Macros , Marketing , mail , Office , MS-DOS , Network , network , Novell Netware , Novell Netware 4.11 , page , Programming , express , Shorthand , technical train , telephone , troubleshoot , Typing , Word Processing , WordPerfect 5.1 , write Additional Information Select font size want use way . Proofread cover letter . Print cover letter , even go upload online , make sure format , properly space , look way want . Writing cover letter seem like difficult task . After , cover letter make sort request - whether interview information - generally address someone n't meet . If take one step time , however , 'll soon expert write cover letter send Job Application Letter Format Contact Information Name Address City , State , Zip Code Phone Number Email Address Date Employer Contact Information ( ) Name Title Company Address City , State , Zip Code Salutation Dear Mr./Ms . Last Name , ( leave n't contact ) Body Application Letter The body application letter let employer know position apply , employer select interview , follow-up . First Paragraph The first paragraph letter include information write . Mention job apply find job list . Include name mutual contact , one . Middle Paragraph ( ) The next section application letter describe offer employer Application Letter Template Contact Information The first section letter include information employer contact . If contact information employer , include . Otherwise , list information . Your Personal Information FirstName LastName Street Address City , State , Zip Code Phone Number Email Address Date;;Intranetware 4.11 Administration 4.1a Advanced Administration 12 1993 Shippensburg University Pennsylvania City , State B.S.B.A : Business Administration/Office Administration 12 1993 John L. Grove College Business Business Administration/Office Administration Business Communication , Business Programming , Marketing , Finance , IBM Software Applications , Management A.A 5 1991 Harrisburg Area Community College City , State GPA : GPA : 3.11 Accounting , IBM Software Applications , Intermediate Lotus 2.1 , Advanced Lotus 2.1 Macros , MS-DOS Commands , IBM Basic Programming , Advanced WordPerfect 5.1 , Novell Netware GPA : 3.11 Academics/Business 1 1988 East Pennsboro Area High School City , State Academics/Business Typing , Word Processing , Office Procedures , Bookkeeping , Shorthand Recipient Award East Pennsboro Most Outstanding Business Student
Osama_Alamri_CV_v5;Osama_Alamri_CV_v5.pdf;;Bachelor Applied Information Systems - Data Science Track , King Saud University 2020  present GPA : 4.48 / 5 Riyadh , Saudi Arabia;Python , R , Java , SQL- Project Management  RDBMS . Decision Making   Data Science & Machine Learning : Data Mining , Collaboration  Data Analysis , Machine Learning Algorithms , Data Communication  Visualization , Computer Vision , NLP . Problem Solving  Tools & Libraries : Pandas , NumPy , matplotlib , Version Control : Git , GitHub   Scikit-Learn , Streamlit , APIs .;AI-Powered Recruitment Candidate Ranking System 02/2025  present A system Automates resume screen , conduct AI-driven interview , rank candidates use NLP , cosine similarity , LLM model create smart platform help company identify suitable candidates use AI . SmartList 01/2025  02/2025 SmartList AI-powered task manager streamline task subtask management smart schedule productivity insights . Its built-in assistant offer AI-driven recommendations efficient plan execution . Loan Prediction system 11/2024  12/2024 Developed machine learn model classify loan applicants use logistic regression decision tree , achieve 87.2 % accuracy . Focused data clean , feature analysis , model evaluation .;UX/UI Design Track  Satr ( 08/2025 ) Python 101 Data Science  IBM ( 02/2025 ) AI Application Building Bootcamp Python  SDAIA ( 01/2025 ) Python Data Science , AI & Development  IBM ( 01/2025 ) Python Project Data Science  IBM ( 01/2025 ) Introduction Data Science Specializations  IBM ( 07/2024 ) Databases SQL Data Science Python  IBM ( 07/2024 )
